{
  "format": "hb-brief/1",
  "templates": "2026.09",
  "topics": "topics-v1",
  "groups": "g2",
  "as_of": "2026-11",
  "revisit": "2027-05",
  "context": "learning",
  "form": "short",
  "tier": "T1",
  "mode_default": "learn",
  "length": "standard",
  "lines": [
    {
      "id": "H"
    },
    {
      "id": "F1"
    },
    {
      "id": "F2"
    },
    {
      "id": "F3"
    },
    {
      "id": "F4"
    },
    {
      "id": "LANG"
    },
    {
      "id": "U1"
    },
    {
      "id": "U2.W3",
      "status": "experimental"
    },
    {
      "id": "U4"
    },
    {
      "id": "U5"
    },
    {
      "id": "DB",
      "topics": [
        "quant/probability_counting"
      ],
      "status": "experimental"
    },
    {
      "id": "K1L"
    },
    {
      "id": "I1",
      "interests": [
        "cooking",
        "football"
      ],
      "status": "experimental"
    }
  ],
  "keywords": {
    "just do it": "do"
  },
  "generator": {
    "version": "brief-0.1.0",
    "zone_rule": "z1",
    "param_version": "p0-spec"
  }
}